{
  "schema_version": "receipt_chain.v0_1",
  "chain_id": "active_mirror_audit_logs",
  "created_at": "2026-07-08T09:33:36Z",
  "receipt_root": ".mirror/AUDIT_LOGS",
  "algorithm": "sha256:audit_file_bytes_then_previous_hash_chain",
  "entry_count": 16,
  "chain_hash": "96c7c25aa99f775204d88b4b69313133e385b4b81c61f17f5956e1f637736320",
  "entries": [
    {
      "index": 0,
      "file": ".mirror/AUDIT_LOGS/20260707T130000Z-amos_local_gates.yaml",
      "audit_id": "audit_20260707t130000z_amos_local_gates",
      "created_at": "2026-07-07T13:00:00Z",
      "decision": "partial",
      "content_hash": "7730e0215df69042390aa5b68c11e4536c5e997f337b8e3e5fb97a7c47dfd8ae",
      "entry_hash": "7b62e568a0c0bdb9bf609b5966a339eecacad2ff7403c9b9d3f998233fbfc991",
      "previous_chain_hash": "genesis",
      "chain_hash": "ebffd97c46cf6ae3ebdeec7cc52fa85e607d12cdb971141d3a2ef6c6b38dd53c"
    },
    {
      "index": 1,
      "file": ".mirror/AUDIT_LOGS/20260707T131500Z-amos_receipt_chain.yaml",
      "audit_id": "audit_20260707t131500z_amos_receipt_chain",
      "created_at": "2026-07-07T13:15:00Z",
      "decision": "partial",
      "content_hash": "276375bbc87c9047641c9a44a5b1fb63f32e84f4eef7d638eaa4f2cba6f4ef53",
      "entry_hash": "7ccd5f3206908375ec1a67a8ae104f6e680effdefc7e942e5fe1dba68e397a5b",
      "previous_chain_hash": "ebffd97c46cf6ae3ebdeec7cc52fa85e607d12cdb971141d3a2ef6c6b38dd53c",
      "chain_hash": "0c26e3c9cfb6e13cd2d9fd9a657f3a913f0d91afc5d3f69cf1f9c6364c88e8b8"
    },
    {
      "index": 2,
      "file": ".mirror/AUDIT_LOGS/20260707T132500Z-amos_status_report.yaml",
      "audit_id": "audit_20260707t132500z_amos_status_report",
      "created_at": "2026-07-07T13:25:00Z",
      "decision": "partial",
      "content_hash": "d6d12b895fd7588255562bae834b3294d95cd2a6542a619e668eaaf37d8327c4",
      "entry_hash": "a8e8ab932ec4f070c8a27ea9ca306de885530ae2d746fcc5c7d6117ea1c624fe",
      "previous_chain_hash": "0c26e3c9cfb6e13cd2d9fd9a657f3a913f0d91afc5d3f69cf1f9c6364c88e8b8",
      "chain_hash": "a11548331fc0f56024e92a0d0174cfa483b50cd3e7db5f7a6cad8032f82de6ce"
    },
    {
      "index": 3,
      "file": ".mirror/AUDIT_LOGS/20260707T132730Z-amos_runtime_integration_contract.yaml",
      "audit_id": "audit_20260707t132730z_amos_runtime_integration_contract",
      "created_at": "2026-07-07T13:27:30Z",
      "decision": "partial",
      "content_hash": "b4ca1ca840bd419893d6bbdc19f8781f89f3dd238f72684327d4547714b1e991",
      "entry_hash": "564114f057831c5c85c4dc5dd7fb5a2d68f61f108767128b8338b6e59f5f27d1",
      "previous_chain_hash": "a11548331fc0f56024e92a0d0174cfa483b50cd3e7db5f7a6cad8032f82de6ce",
      "chain_hash": "d583f5d6b312bf3f07f62c25d249c316f443261560dd0d27ae4c1d0471c28a35"
    },
    {
      "index": 4,
      "file": ".mirror/AUDIT_LOGS/20260707T133841Z-amos_shadow_adapter.yaml",
      "audit_id": "audit_20260707t133841z_amos_shadow_adapter",
      "created_at": "2026-07-07T13:38:41Z",
      "decision": "partial",
      "content_hash": "0130ee1737570dc1c4d36d96c332b4a5ea56799372b890763283bb2437981979",
      "entry_hash": "24786a5fde02a607be1a07c36b68383c66fc23116908ddb7c4b8e8840aed00c6",
      "previous_chain_hash": "d583f5d6b312bf3f07f62c25d249c316f443261560dd0d27ae4c1d0471c28a35",
      "chain_hash": "9e2f8bf4ecf6ebe98d515c3ee360c58f1f8b39bc6eaf6a09e8013b0ade9801cb"
    },
    {
      "index": 5,
      "file": ".mirror/AUDIT_LOGS/20260707T134909Z-amos_readonly_app_adapter.yaml",
      "audit_id": "audit_20260707t134909z_amos_readonly_app_adapter",
      "created_at": "2026-07-07T13:49:09Z",
      "decision": "partial",
      "content_hash": "79e3f2b770ee306a752b37701c295df195d08cd7642af38cbb4f5578d5ee0475",
      "entry_hash": "b97010772e66b4c2bcf82fbc37c738cb020414d4ebddb9f1cbc1c1d61d636d79",
      "previous_chain_hash": "9e2f8bf4ecf6ebe98d515c3ee360c58f1f8b39bc6eaf6a09e8013b0ade9801cb",
      "chain_hash": "7bca410af476af84bc8379d663c9ac879cce6d393ae0a161b03c639e27fbf52a"
    },
    {
      "index": 6,
      "file": ".mirror/AUDIT_LOGS/20260707T140008Z-amos_browser_runtime_adapter.yaml",
      "audit_id": "audit_20260707t140008z_amos_browser_runtime_adapter",
      "created_at": "2026-07-07T14:00:08Z",
      "decision": "partial",
      "content_hash": "469819aabdc0680193583cb31f5dfb8bcb3492a78fa5e4306daa06cad3c0bdc4",
      "entry_hash": "fe293ea36bbe6303786b0d3bd18d757a2b51e615bdc6aff8c2bc660017e45a52",
      "previous_chain_hash": "7bca410af476af84bc8379d663c9ac879cce6d393ae0a161b03c639e27fbf52a",
      "chain_hash": "ea6577c2990bbe8c28ca7fe21f56e873b973d49c922165c39414eca8e5fb9eed"
    },
    {
      "index": 7,
      "file": ".mirror/AUDIT_LOGS/20260707T140840Z-amos_ui_harness.yaml",
      "audit_id": "audit_20260707t140840z_amos_ui_harness",
      "created_at": "2026-07-07T14:08:40Z",
      "decision": "partial",
      "content_hash": "b111dba61d0bd4cb3e0e3edde3f753a24d6f3518813a936b6226548bbb63ce6d",
      "entry_hash": "9edbf29b2061fe73f4c48009c566697d8a964782a08dc281a7da4c3a9310a068",
      "previous_chain_hash": "ea6577c2990bbe8c28ca7fe21f56e873b973d49c922165c39414eca8e5fb9eed",
      "chain_hash": "fdb7bc444c795db967d665ffbf2cbe869cb86e5a7112eb46b010906a455e9a05"
    },
    {
      "index": 8,
      "file": ".mirror/AUDIT_LOGS/20260707T141644Z-amos_disabled_source_adapter.yaml",
      "audit_id": "audit_20260707t141644z_amos_disabled_source_adapter",
      "created_at": "2026-07-07T14:16:44Z",
      "decision": "partial",
      "content_hash": "1c6b46fe1f331de16a8e49c283d273ae066628ce6adf807210aa8b9aeff86995",
      "entry_hash": "35513d0bc99cf3f587c45e4bc589338d45469ecbf7a769c66753cb35edae20a3",
      "previous_chain_hash": "fdb7bc444c795db967d665ffbf2cbe869cb86e5a7112eb46b010906a455e9a05",
      "chain_hash": "d2a8ff92f0dbe9fd6e2d8265c9b6f2b6c5ebe7da4822a872bf43010d505e91db"
    },
    {
      "index": 9,
      "file": ".mirror/AUDIT_LOGS/20260707T143217Z-amos_source_adapter_import_proposal.yaml",
      "audit_id": "audit_20260707t143217z_amos_source_adapter_import_proposal",
      "created_at": "2026-07-07T14:32:17Z",
      "decision": "partial",
      "content_hash": "02a0a051b770ca1923fa8944362e430ea1ebb51b4cc680001d3dc7e15760c070",
      "entry_hash": "2eaecc8590c728bb7a89b9b7cecce19fe118f11e177a6fc9c41f11873e622b12",
      "previous_chain_hash": "d2a8ff92f0dbe9fd6e2d8265c9b6f2b6c5ebe7da4822a872bf43010d505e91db",
      "chain_hash": "8040b756a40d5dd15d136ac539cac614dea73bae63237e244af18b2f9780d7e6"
    },
    {
      "index": 10,
      "file": ".mirror/AUDIT_LOGS/20260707T144553Z-amos_source_adapter_import_approval_bridge.yaml",
      "audit_id": "audit_20260707t144553z_amos_source_adapter_import_approval_bridge",
      "created_at": "2026-07-07T14:45:53Z",
      "decision": "partial",
      "content_hash": "167a22fb1deb1cd1dc3c4caeaadffae0f310671e9336c372e9e84bc2a749f887",
      "entry_hash": "53d8f2e4bee1f958ce5e6d7723cba8cea3ac2263d5847ab8e3e05c183945ca92",
      "previous_chain_hash": "8040b756a40d5dd15d136ac539cac614dea73bae63237e244af18b2f9780d7e6",
      "chain_hash": "ed0eed730ada9f371589dcb9f206bd7fb801733e511e6972c35175ac3280b47c"
    },
    {
      "index": 11,
      "file": ".mirror/AUDIT_LOGS/20260707T153055Z-amos_source_adapter_import_approval_create.yaml",
      "audit_id": "audit_20260707t153055z_amos_source_adapter_import_approval_create",
      "created_at": "2026-07-07T15:30:55Z",
      "decision": "partial",
      "content_hash": "d5f259dd96c12b167378ae19c21ca9230c2b78da3eb9fb67ae4168b12dca30dd",
      "entry_hash": "e1d9d01174658a040952aef369ecc960b522a92f4ae53ef6f145bd8be2229fd7",
      "previous_chain_hash": "ed0eed730ada9f371589dcb9f206bd7fb801733e511e6972c35175ac3280b47c",
      "chain_hash": "dbaf7b305fe68457a96a918db0aa84f93b584332214461eb65f6c7643b803d29"
    },
    {
      "index": 12,
      "file": ".mirror/AUDIT_LOGS/20260707T160235Z-amos_source_adapter_import_patch.yaml",
      "audit_id": "audit_20260707t160235z_amos_source_adapter_import_patch",
      "created_at": "2026-07-07T16:02:35Z",
      "decision": "partial",
      "content_hash": "24878ad36e469843cd0f8f279c014a85c8485cfe508f23fe83e10b8faf7ed590",
      "entry_hash": "0f6b19d535bff7043a02b6f514455ea8a4eb82c5430b81f82f5bfd3374f06ac5",
      "previous_chain_hash": "dbaf7b305fe68457a96a918db0aa84f93b584332214461eb65f6c7643b803d29",
      "chain_hash": "4be41f0ffde47801a7c2095c937841a1fbd62e2b285037d7e4e6607ee808ec68"
    },
    {
      "index": 13,
      "file": ".mirror/AUDIT_LOGS/20260708T084032Z-amos_source_adapter_import_apply.yaml",
      "audit_id": "audit_20260708t084032z_amos_source_adapter_import_apply",
      "created_at": "2026-07-08T08:40:32Z",
      "decision": "partial",
      "content_hash": "42a8a69e87cd524526dd8eb355cdafe419ede9abbc51c7d889d6ac13f2dc1e75",
      "entry_hash": "6f4422e83eedc37c3566b0a47b8d5963bff9c6381b055bf066dcb958fb61bd36",
      "previous_chain_hash": "4be41f0ffde47801a7c2095c937841a1fbd62e2b285037d7e4e6607ee808ec68",
      "chain_hash": "381676fa0ea7564ed59c90b6983a582a2c49305712515ea1f7ff9b83364515a6"
    },
    {
      "index": 14,
      "file": ".mirror/AUDIT_LOGS/20260708T091526Z-amos_source_adapter_import_applied.yaml",
      "audit_id": "audit_20260708t091526z_amos_source_adapter_import_applied",
      "created_at": "2026-07-08T09:15:26Z",
      "decision": "partial",
      "content_hash": "4945b58d1729af974a0c9c9e6158bcc7ea114613cb3be13841090cdb56f4565f",
      "entry_hash": "4bfce6e49d939b901a6dc428a346cd92cc224f49b2c4ecbf7e3919354d679e06",
      "previous_chain_hash": "381676fa0ea7564ed59c90b6983a582a2c49305712515ea1f7ff9b83364515a6",
      "chain_hash": "2e6d9a76d59f987575230781bb8e8f094a4f6744dd44fe07505779dfc9afa2cc"
    },
    {
      "index": 15,
      "file": ".mirror/AUDIT_LOGS/20260708T093336Z-amos_source_adapter_invocation_contract.yaml",
      "audit_id": "audit_20260708t093336z_amos_source_adapter_invocation_contract",
      "created_at": "2026-07-08T09:33:36Z",
      "decision": "partial",